id;Sector;Category;name;fed_okr;region;authority
187;;Calssic;Оренбургский государственный университет;Приволжский федеральный округ;Оренбургская область;Министерство науки и высшего образования Российской Федерации
1702;Agricultural;Sectoral;Оренбургский государственный аграрный университет;Приволжский федеральный округ;Оренбургская область;Министерство сельского хозяйства Российской Федерации
1624;Medical;Sectoral;Оренбургский государственный медицинский университет Министерства здравоохранения Российской Федерации;Приволжский федеральный округ;Оренбургская область;Министерство здравоохранения Российской Федерации
192;Technical;Sectoral;Пензенский государственный технологический университет;Приволжский федеральный округ;Пензенская область;Министерство науки и высшего образования Российской Федерации
194;;Calssic;Пензенский государственный университет;Приволжский федеральный округ;Пензенская область;Министерство науки и высшего образования Российской Федерации
1632;Agricultural;Sectoral;#Н/Д;Приволжский федеральный округ;Пензенская область;Министерство сельского хозяйства Российской Федерации
195;Architectural;Sectoral;Пензенский государственный университет архитектуры и строительства;Приволжский федеральный округ;Пензенская область;Министерство науки и высшего образования Российской Федерации
197;;National Research;Пермский национальный исследовательский политехнический университет;Приволжский федеральный округ;Пермский край;Министерство науки и высшего образования Российской Федерации
198;;National Research;Пермский государственный национальный исследовательский университет;Приволжский федеральный округ;Пермский край;Министерство науки и высшего образования Российской Федерации
1577;Medical;Sectoral;Пермская государственная фармацевтическая академия Министерства здравоохранения Российской Федерации;Приволжский федеральный округ;Пермский край;Министерство здравоохранения Российской Федерации
196;Pedagogical;Sectoral;Пермский государственный гуманитарно-педагогический университет (ПГГПУ);Приволжский федеральный округ;Пермский край;Министерство просвещения Российской Федерации
1776;Arts;Sectoral;Пермский государственный институт культуры;Приволжский федеральный округ;Пермский край;Министерство культуры Российской Федерации
1775;Sport;Sectoral;Чайковская государственная академия физической культуры и спорта;Приволжский федеральный округ;Пермский край;Министерство спорта Российской Федерации
1664;Technical;Sectoral;Пермский государственный аграрно-технологический университет имени академика Д.Н. Прянишникова;Приволжский федеральный округ;Пермский край;Министерство науки и высшего образования Российской Федерации
1796;Medical;Sectoral;Пермский государственный медицинский университет имени академика Е.А. Вагнера Министерства здравоохранения Российской Федерации;Приволжский федеральный округ;Пермский край;Министерство здравоохранения Российской Федерации
110160;Social Sciences and Humanities;Sectoral;Башкирская академия государственной службы и управления при Главе Республики Башкортостан;Приволжский федеральный округ;Республика Башкортостан;Муниципалитеты и субъекты РФ
1701;Agricultural;Sectoral;Башкирский государственный аграрный университет;Приволжский федеральный округ;Республика Башкортостан;Министерство сельского хозяйства Российской Федерации
1703;Arts;Sectoral;Уфимский государственный институт искусств имени Загира Исмагилова;Приволжский федеральный округ;Республика Башкортостан;Министерство культуры Российской Федерации
1731;Medical;Sectoral;Башкирский государственный медицинский университет Министерства здравоохранения Российской Федерации;Приволжский федеральный округ;Республика Башкортостан;Министерство здравоохранения Российской Федерации
14;Pedagogical;Sectoral;Башкирский государственный педагогический университет им. М. Акмуллы;Приволжский федеральный округ;Республика Башкортостан;Министерство просвещения Российской Федерации
319;;Federal and Flagship;Уфимский государственный нефтяной технический университет;Приволжский федеральный округ;Республика Башкортостан;Министерство науки и высшего образования Российской Федерации
666669204;Technical;Sectoral;Уфимский университет науки и технологий;Приволжский федеральный округ;Республика Башкортостан;Министерство науки и высшего образования Российской Федерации
123;Technical;Sectoral;Поволжский государственный технологический университет;Приволжский федеральный округ;Республика Марий Эл;Министерство науки и высшего образования Российской Федерации
124;;Federal and Flagship;Марийский государственный университет;Приволжский федеральный округ;Республика Марий Эл;Министерство науки и высшего образования Российской Федерации
126;Pedagogical;Sectoral;Мордовский государственный педагогический университет имени М.Е. Евсевьева;Приволжский федеральный округ;Республика Мордовия;Министерство просвещения Российской Федерации
127;;National Research;Национальный исследовательский Мордовский государственный университет им. Н.П.Огарева;Приволжский федеральный округ;Республика Мордовия;Министерство науки и высшего образования Российской Федерации
110154;Technical;Sectoral;Альметьевский государственный нефтяной институт;Приволжский федеральный округ;Республика Татарстан;Муниципалитеты и субъекты РФ
1519;;Federal and Flagship;Казанский (Приволжский) федеральный университет;Приволжский федеральный округ;Республика Татарстан;Министерство науки и высшего образования Российской Федерации
1670;Agricultural;Sectoral;Казанская государственная академия ветеринарной медицины имени Н.Э. Баумана (ФГБОУ ВО Казанская ГАВМ);Приволжский федеральный округ;Республика Татарстан;Министерство сельского хозяйства Российской Федерации
1764;Agricultural;Sectoral;Казанский государственный аграрный университет;Приволжский федеральный округ;Республика Татарстан;Министерство сельского хозяйства Российской Федерации
86;Architectural;Sectoral;Казанский государственный архитектурно-строительный университет;Приволжский федеральный округ;Республика Татарстан;Министерство науки и высшего образования Российской Федерации
1646;Arts;Sectoral;Казанский государственный институт культуры;Приволжский федеральный округ;Республика Татарстан;Министерство культуры Российской Федерации
91;Technical;Sectoral;Казанский государственный энергетический университет;Приволжский федеральный округ;Республика Татарстан;Министерство науки и высшего образования Российской Федерации
87;;National Research;Казанский национальный исследовательский технический университет им. А.Н. Туполева-КАИ;Приволжский федеральный округ;Республика Татарстан;Министерство науки и высшего образования Российской Федерации
88;;National Research;Казанский национальный исследовательский технологический университет;Приволжский федеральный округ;Республика Татарстан;Министерство науки и высшего образования Российской Федерации
1698;Arts;Sectoral;Казанская государственная консерватория имени Н.Г.Жиганова;Приволжский федеральный округ;Республика Татарстан;Министерство культуры Российской Федерации
1562;Medical;Sectoral;Казанский государственный медицинский университет Министерства здравоохранения Российской Федерации;Приволжский федеральный округ;Республика Татарстан;Министерство здравоохранения Российской Федерации
164;Pedagogical;Sectoral;Набережночелнинский государственный педагогический университет;Приволжский федеральный округ;Республика Татарстан;Министерство просвещения Российской Федерации
1748;Sport;Sectoral;Поволжский государственный университет физической культуры, спорта и туризма;Приволжский федеральный округ;Республика Татарстан;Министерство спорта Российской Федерации
254;Social Sciences and Humanities;Sectoral;Самарский государственный экономический университет;Приволжский федеральный округ;Самарская область;Министерство науки и высшего образования Российской Федерации
251;;National Research;Самарский национальный исследовательский университет имени академика С.П. Королева;Приволжский федеральный округ;Самарская область;Министерство науки и высшего образования Российской Федерации
1685;Agricultural;Sectoral;Самарский государственный аграрный университет;Приволжский федеральный округ;Самарская область;Министерство сельского хозяйства Российской Федерации
1696;Arts;Sectoral;Самарский государственный институт культуры;Приволжский федеральный округ;Самарская область;Министерство культуры Российской Федерации
1581;Medical;Sectoral;Самарский государственный медицинский университет Министерства здравоохранения Российской Федерации;Приволжский федеральный округ;Самарская область;Министерство здравоохранения Российской Федерации
252;;Federal and Flagship;Самарский государственный технический университет;Приволжский федеральный округ;Самарская область;Министерство науки и высшего образования Российской Федерации
202;Social Sciences and Humanities;Sectoral;Поволжский государственный университет сервиса;Приволжский федеральный округ;Самарская область;Министерство науки и высшего образования Российской Федерации
1570;Technical;Sectoral;Поволжский государственный университет телекоммуникаций и информатики;Приволжский федеральный округ;Самарская область;Федеральное агентство связи
201;Pedagogical;Sectoral;Самарский государственный социально-педагогический университет;Приволжский федеральный округ;Самарская область;Министерство просвещения Российской Федерации
1603;Trasport;Sectoral;Самарский государственный университет путей сообщения;Приволжский федеральный округ;Самарская область;Федеральное агентство железнодорожного транспорта
291;;Federal and Flagship;Тольяттинский государственный университет;Приволжский федеральный округ;Самарская область;Министерство науки и высшего образования Российской Федерации
255;Social Sciences and Humanities;Sectoral;Саратовская государственная юридическая академия;Приволжский федеральный округ;Саратовская область;Министерство науки и высшего образования Российской Федерации
1730;Arts;Sectoral;Саратовская государственная консерватория имени Л.В. Собинова;Приволжский федеральный округ;Саратовская область;Министерство культуры Российской Федерации
1711;Medical;Sectoral;Саратовский государственный медицинский университет имени В.И. Разумовского Министерства здравоохранения Российской Федерации;Приволжский федеральный округ;Саратовская область;Министерство здравоохранения Российской Федерации
257;;Federal and Flagship;Саратовский государственный технический университет имени Гагарина Ю.А.;Приволжский федеральный округ;Саратовская область;Министерство науки и высшего образования Российской Федерации
1661;Agricultural;Sectoral;Саратовский государственный университет генетики, биотехнологии и инженерии имени Н. И. Вавилова;Приволжский федеральный округ;Саратовская область;Министерство сельского хозяйства Российской Федерации
258;;National Research;Саратовский национальный исследовательский государственный университет имени Н.Г. Чернышевского;Приволжский федеральный округ;Саратовская область;Министерство науки и высшего образования Российской Федерации
52;Pedagogical;Sectoral;Глазовский государственный педагогический институт имени В.Г. Короленко;Приволжский федеральный округ;Удмуртская Республика;Министерство просвещения Российской Федерации
1584;Medical;Sectoral;Ижевская государственная медицинская академия Министерства здравоохранения Российской Федерации;Приволжский федеральный округ;Удмуртская Республика;Министерство здравоохранения Российской Федерации
1683;Agricultural;Sectoral;Удмуртский государственный аграрный университет;Приволжский федеральный округ;Удмуртская Республика;Министерство сельского хозяйства Российской Федерации
79;Technical;Sectoral;Ижевский государственный технический университет имени М.Т. Калашникова;Приволжский федеральный округ;Удмуртская Республика;Министерство науки и высшего образования Российской Федерации
303;;Calssic;Удмуртский государственный университет;Приволжский федеральный округ;Удмуртская Республика;Министерство науки и высшего образования Российской Федерации
304;Pedagogical;Sectoral;Ульяновский государственный педагогический университет имени И.Н. Ульянова;Приволжский федеральный округ;Ульяновская область;Министерство просвещения Российской Федерации
1643;Agricultural;Sectoral;Ульяновский государственный аграрный университет имени П.А.Столыпина;Приволжский федеральный округ;Ульяновская область;Министерство сельского хозяйства Российской Федерации
305;Technical;Sectoral;Ульяновский государственный технический университет;Приволжский федеральный округ;Ульяновская область;Министерство науки и высшего образования Российской Федерации
306;;Federal and Flagship;Ульяновский государственный университет;Приволжский федеральный округ;Ульяновская область;Министерство науки и высшего образования Российской Федерации
1760;Trasport;Sectoral;Ульяновский институт гражданской авиации имени Главного маршала авиации Б.П. Бугаева;Приволжский федеральный округ;Ульяновская область;Федеральное агентство воздушного транспорта
110431;Arts;Sectoral;Бюджетное образовательное учреждение высшего образования Чувашской Республики Чувашский государственный институт культуры и искусств Министерства культуры, по делам национальностей и архивного дела Чувашской Республики;Приволжский федеральный округ;Чувашская Республика;Муниципалитеты и субъекты РФ
329;Pedagogical;Sectoral;Чувашский государственный педагогический университет им. И.Я. Яковлева;Приволжский федеральный округ;Чувашская Республика;Министерство просвещения Российской Федерации
330;;Calssic;Чувашский государственный университет имени И.Н. Ульянова;Приволжский федеральный округ;Чувашская Республика;Министерство науки и высшего образования Российской Федерации
1689;Agricultural;Sectoral;Чувашский государственный аграрный университет;Приволжский федеральный округ;Чувашская Республика;Министерство сельского хозяйства Российской Федерации
110155;Architectural;Sectoral;государственное автономное образовательное учреждение Астраханской области высшего образования Астраханский государственный архитектурно-строительный университет;Южный федеральный округ;Астраханская область;Муниципалитеты и субъекты РФ
1655;Arts;Sectoral;Астраханская государственная консерватория;Южный федеральный округ;Астраханская область;Министерство культуры Российской Федерации
1563;Technical;Sectoral;Астраханский государственный технический университет;Южный федеральный округ;Астраханская область;Федеральное агентство по рыболовству
1718;Medical;Sectoral;Астраханский государственный медицинский университет Министерства здравоохранения Российской Федерации;Южный федеральный округ;Астраханская область;Министерство здравоохранения Российской Федерации
