id;Sector;Category;name;fed_okr;region;authority
110161;Arts;Sectoral;Белгородский государственный институт искусств и культуры;Центральный федеральный округ;Белгородская область;Муниципалитеты и субъекты РФ
17;;National Research;Белгородский государственный национальный исследовательский университет;Центральный федеральный округ;Белгородская область;Министерство науки и высшего образования Российской Федерации
16;;Federal and Flagship;Белгородский государственный технологический университет им. В.Г. Шухова;Центральный федеральный округ;Белгородская область;Министерство науки и высшего образования Российской Федерации
1675;Agricultural;Sectoral;Белгородский государственный аграрный университет имени В.Я. Горина;Центральный федеральный округ;Белгородская область;Министерство сельского хозяйства Российской Федерации
24;Technical;Sectoral;Брянский государственный инженерно-технологический университет;Центральный федеральный округ;Брянская область;Министерство науки и высшего образования Российской Федерации
25;Technical;Sectoral;Брянский государственный технический университет;Центральный федеральный округ;Брянская область;Министерство науки и высшего образования Российской Федерации
1772;Agricultural;Sectoral;Брянский государственный аграрный университет;Центральный федеральный округ;Брянская область;Министерство сельского хозяйства Российской Федерации
26;;Calssic;Брянский государственный университет имени академика И.Г. Петровского;Центральный федеральный округ;Брянская область;Министерство науки и высшего образования Российской Федерации
30;;Federal and Flagship;Владимирский государственный университет имени Александра Григорьевича и Николая Григорьевича Столетовых;Центральный федеральный округ;Владимирская область;Министерство науки и высшего образования Российской Федерации
101;Technical;Sectoral;Ковровская государственная технологическая академия имени В.А. Дегтярева;Центральный федеральный округ;Владимирская область;Министерство науки и высшего образования Российской Федерации
110169;Social Sciences and Humanities;Sectoral;Воронежский институт экономики и социального управления;Центральный федеральный округ;Воронежская область;Муниципалитеты и субъекты РФ
1650;Agricultural;Sectoral;Воронежский государственный аграрный университет имени императора Петра I;Центральный федеральный округ;Воронежская область;Министерство сельского хозяйства Российской Федерации
43;Pedagogical;Sectoral;Воронежский государственный педагогический университет;Центральный федеральный округ;Воронежская область;Министерство просвещения Российской Федерации
45;;Calssic;Воронежский государственный университет;Центральный федеральный округ;Воронежская область;Министерство науки и высшего образования Российской Федерации
1762;Sport;Sectoral;Воронежская государственная академия спорта;Центральный федеральный округ;Воронежская область;Министерство спорта Российской Федерации
1653;Arts;Sectoral;Воронежский государственный институт искусств;Центральный федеральный округ;Воронежская область;Министерство культуры Российской Федерации
40;Technical;Sectoral;Воронежский государственный лесотехнический университет имени Г.Ф. Морозова;Центральный федеральный округ;Воронежская область;Министерство науки и высшего образования Российской Федерации
1594;Medical;Sectoral;Воронежский государственный медицинский университет имени Н.Н. Бурденко Министерства здравоохранения Российской Федерации;Центральный федеральный округ;Воронежская область;Министерство здравоохранения Российской Федерации
44;;Federal and Flagship;Воронежский государственный технический университет;Центральный федеральный округ;Воронежская область;Министерство науки и высшего образования Российской Федерации
41;Technical;Sectoral;Воронежский государственный университет инженерных технологий;Центральный федеральный округ;Воронежская область;Министерство науки и высшего образования Российской Федерации
110313;Social Sciences and Humanities;Sectoral;Московский городской университет управления Правительства Москвы имени Ю.М.Лужкова;Центральный федеральный округ;г. Москва;Муниципалитеты и субъекты РФ
2183;Pedagogical;Sectoral;города Москвы Московский городской педагогический университет;Центральный федеральный округ;г. Москва;Муниципалитеты и субъекты РФ
110314;Sport;Sectoral;города Москвы Московский государственный университет спорта и туризма;Центральный федеральный округ;г. Москва;Муниципалитеты и субъекты РФ
110315;Arts;Sectoral;города Москвы Московский государственный институт музыки имени А.Г. Шнитке;Центральный федеральный округ;г. Москва;Муниципалитеты и субъекты РФ
108162;Arts;Sectoral;Московская театральная школа Олега Табакова при Государственном бюджетном учреждении культуры города Москвы Московский театр Олега Табакова;Центральный федеральный округ;г. Москва;Муниципалитеты и субъекты РФ
1593;Technical;Sectoral;Ордена Трудового Красного Знамени Московский технический университет связи и информатики;Центральный федеральный округ;г. Москва;Федеральное агентство связи
161;;National Research;Московский физико-технический институт (национальный исследовательский университет);Центральный федеральный округ;г. Москва;Министерство науки и высшего образования Российской Федерации
140;;National Research;Национальный исследовательский университет Московский институт электронной техники;Центральный федеральный округ;г. Москва;Министерство науки и высшего образования Российской Федерации
219;;National Research;Российский государственный университет нефти и газа (национальный исследовательский университет) имени И.М. Губкина;Центральный федеральный округ;г. Москва;Министерство науки и высшего образования Российской Федерации
1595;Medical;Sectoral;Российский национальный исследовательский медицинский университет имени Н.И. Пирогова Министерства здравоохранения Российской Федерации;Центральный федеральный округ;г. Москва;Министерство здравоохранения Российской Федерации
1758;Social Sciences and Humanities;Sectoral;Московский государственный институт международных отношений (университет) Министерства иностранных дел Российской Федерации;Центральный федеральный округ;г. Москва;Министерство иностранных дел Российской Федерации
120111;Technical;Sectoral;Московский политехнический университет;Центральный федеральный округ;г. Москва;Министерство науки и высшего образования Российской Федерации
59;;National Research;Национальный исследовательский технологический университет МИСиС;Центральный федеральный округ;г. Москва;Министерство науки и высшего образования Российской Федерации
1766;;National Research;Национальный исследовательский университет Высшая школа экономики;Центральный федеральный округ;г. Москва;Правительство Российской Федерации
165;;National Research;Национальный исследовательский ядерный университет МИФИ;Центральный федеральный округ;г. Москва;Министерство науки и высшего образования Российской Федерации
222;;Calssic;Российский университет дружбы народов имени Патриса Лумумбы;Центральный федеральный округ;г. Москва;Министерство науки и высшего образования Российской Федерации
1566;Trasport;Sectoral;Российский университет транспорта;Центральный федеральный округ;г. Москва;Министерство транспорта Российской Федерации
1792;Medical;Sectoral;Первый Московский государственный медицинский университет имени И.М. Сеченова Министерства здравоохранения Российской Федерации (Сеченовский Университет);Центральный федеральный округ;г. Москва;Министерство здравоохранения Российской Федерации
111029;Arts;Sectoral;Академия акварели и изящных искусств Сергея Андрияки;Центральный федеральный округ;г. Москва;Министерство культуры Российской Федерации
1810;Social Sciences and Humanities;Sectoral;Всероссийская академия внешней торговли министерства экономического развития Российской Федерации;Центральный федеральный округ;г. Москва;Министерство экономического развития Российской Федерации
1723;Arts;Sectoral;Всероссийский государственный университет кинематографии имени С.А. Герасимова;Центральный федеральный округ;г. Москва;Министерство культуры Российской Федерации
1668;Arts;Sectoral;Высшее театральное училище (институт) им.М.С.Щепкина при Государственном академическом Малом театре России;Центральный федеральный округ;г. Москва;Министерство культуры Российской Федерации
1639;Technical;Sectoral;Государственный университет по землеустройству;Центральный федеральный округ;г. Москва;Министерство сельского хозяйства Российской Федерации
60;Social Sciences and Humanities;Sectoral;Государственный университет управления;Центральный федеральный округ;г. Москва;Министерство науки и высшего образования Российской Федерации
118;Arts;Sectoral;Литературный институт имени А.М. Горького;Центральный федеральный округ;г. Москва;Министерство культуры Российской Федерации
1647;Arts;Sectoral;Московская государственная консерватория имени П.И. Чайковского;Центральный федеральный округ;г. Москва;Министерство культуры Российской Федерации
131;;National Research;Московский авиационный институт (национальный исследовательский университет);Центральный федеральный округ;г. Москва;Министерство науки и высшего образования Российской Федерации
132;Technical;Sectoral;Московский автомобильно-дорожный государственный технический университет (МАДИ);Центральный федеральный округ;г. Москва;Министерство науки и высшего образования Российской Федерации
133;Architectural;Sectoral;Московский архитектурный институт (государственная академия);Центральный федеральный округ;г. Москва;Министерство науки и высшего образования Российской Федерации
141;Social Sciences and Humanities;Sectoral;Московский государственный лингвистический университет;Центральный федеральный округ;г. Москва;Министерство науки и высшего образования Российской Федерации
2151;Pedagogical;Sectoral;Московский государственный психолого-педагогический университет;Центральный федеральный округ;г. Москва;Министерство просвещения Российской Федерации
148;Technical;Sectoral;Московский государственный технологический университет СТАНКИН;Центральный федеральный округ;г. Москва;Министерство науки и высшего образования Российской Федерации
160;Pedagogical;Sectoral;Московский педагогический государственный университет;Центральный федеральный округ;г. Москва;Министерство просвещения Российской Федерации
144;;National Research;Национальный исследовательский Московский государственный строительный университет;Центральный федеральный округ;г. Москва;Министерство науки и высшего образования Российской Федерации
1807;Arts;Sectoral;Российская академия живописи, ваяния и зодчества Ильи Глазунова;Центральный федеральный округ;г. Москва;Правительство Российской Федерации
1783;Social Sciences and Humanities;Sectoral;Российская академия народного хозяйства и государственной службы при Президенте Российской Федерации;Центральный федеральный округ;г. Москва;Правительство Российской Федерации
1716;Social Sciences and Humanities;Sectoral;Российская государственная академия интеллектуальной собственности;Центральный федеральный округ;г. Москва;Федеральная служба по интеллектуальной собственности
1644;Arts;Sectoral;Российская государственная специализированная академия искусств;Центральный федеральный округ;г. Москва;Министерство культуры Российской Федерации
1640;Agricultural;Sectoral;Российский государственный аграрный университет - МСХА имени К.А.Тимирязева;Центральный федеральный округ;г. Москва;Министерство сельского хозяйства Российской Федерации
212;Arts;Sectoral;Российский государственный гуманитарный университет;Центральный федеральный округ;г. Москва;Министерство науки и высшего образования Российской Федерации
151;;Calssic;Российский государственный университет им. А.Н. Косыгина (Технологии. Дизайн. Искусство);Центральный федеральный округ;г. Москва;Министерство науки и высшего образования Российской Федерации
1787;Sport;Sectoral;Российский университет спорта ГЦОЛИФК;Центральный федеральный округ;г. Москва;Министерство спорта Российской Федерации
223;Technical;Sectoral;Российский химико-технологический университет имени Д.И. Менделеева;Центральный федеральный округ;г. Москва;Министерство науки и высшего образования Российской Федерации
1556;Arts;Sectoral;Театральный институт имени Бориса Щукина при Государственном академическом театре имени Евгения Вахтангова;Центральный федеральный округ;г. Москва;Министерство культуры Российской Федерации
1791;Arts;Sectoral;Школа-студия (институт) имени Вл. И.Немировича-Данченко при Московском Художественном академическом театре имени А.П.Чехова;Центральный федеральный округ;г. Москва;Министерство культуры Российской Федерации
1654;Social Sciences and Humanities;Sectoral;Всеросcийский государственный университет юстиции (РПА Минюста России);Центральный федеральный округ;г. Москва;Министерство юстиции Российской Федерации
57;Arts;Sectoral;Государственный академический университет гуманитарных наук;Центральный федеральный округ;г. Москва;Министерство науки и высшего образования Российской Федерации
58;Social Sciences and Humanities;Sectoral;Государственный институт русского языка им. А.С. Пушкина;Центральный федеральный округ;г. Москва;Министерство науки и высшего образования Российской Федерации
1729;Arts;Sectoral;Государственный музыкально-педагогический институт имени М.М. Ипполитова-Иванова;Центральный федеральный округ;г. Москва;Министерство культуры Российской Федерации
1798;Social Sciences and Humanities;Sectoral;Дипломатическая академия Министерства иностранных дел Российской Федерации;Центральный федеральный округ;г. Москва;Министерство иностранных дел Российской Федерации
134;Technical;Sectoral;МИРЭА - Российский технологический университет;Центральный федеральный округ;г. Москва;Министерство науки и высшего образования Российской Федерации
1788;Agricultural;Sectoral;Московская государственная академия ветеринарной медицины и биотехнологии - МВА имени К.И. Скрябина;Центральный федеральный округ;г. Москва;Министерство сельского хозяйства Российской Федерации
1659;Arts;Sectoral;Московская государственная академия хореографии;Центральный федеральный округ;г. Москва;Министерство культуры Российской Федерации
1806;Arts;Sectoral;Московский государственный академический художественный институт имени В.И. Сурикова при Российской академии художеств (МГАХИ им. В.И. Сурикова);Центральный федеральный округ;г. Москва;Министерство культуры Российской Федерации
1610;Medical;Sectoral;Московский государственный медико-стоматологический университет имени А.И. Евдокимова Министерства здравоохранения Российской Федерации;Центральный федеральный округ;г. Москва;Министерство здравоохранения Российской Федерации
1739;Trasport;Sectoral;Московский государственный технический университет гражданской авиации (МГТУ ГА);Центральный федеральный округ;г. Москва;Федеральное агентство воздушного транспорта
