id;Sector;Category;name;fed_okr;region;authority
1544;;Federal and Flagship;Северный (Арктический) федеральный университет имени М. В. Ломоносова.;Северо-Западный федеральный округ;Архангельская область;Министерство науки и высшего образования Российской Федерации
1579;Medical;Sectoral;Северный государственный медицинский университет Министерства здравоохранения Российской Федерации;Северо-Западный федеральный округ;Архангельская область;Министерство здравоохранения Российской Федерации
1672;Agricultural;Sectoral;Вологодская государственная молочнохозяйственная академия имени Н.В.Верещагина;Северо-Западный федеральный округ;Вологодская область;Министерство сельского хозяйства Российской Федерации
39;;Calssic;Вологодский государственный университет;Северо-Западный федеральный округ;Вологодская область;Министерство науки и высшего образования Российской Федерации
325;;Federal and Flagship;Череповецкий государственный университет;Северо-Западный федеральный округ;Вологодская область;Министерство науки и высшего образования Российской Федерации
110291;;Federal and Flagship;Ленинградской области Ленинградский государственный университет имени А.С. Пушкина;Северо-Западный федеральный округ;г. Санкт-Петербург;Муниципалитеты и субъекты РФ
110381;Social Sciences and Humanities;Sectoral;Санкт-Петербургское Санкт-Петербургский государственный институт психологии и социальной работы;Северо-Западный федеральный округ;г. Санкт-Петербург;Муниципалитеты и субъекты РФ
234;;National Research;Национальный исследовательский университет ИТМО;Северо-Западный федеральный округ;г. Санкт-Петербург;Министерство науки и высшего образования Российской Федерации
243;Technical;Sectoral;Санкт-Петербургский государственный университет аэрокосмического приборостроения;Северо-Западный федеральный округ;г. Санкт-Петербург;Министерство науки и высшего образования Российской Федерации
247;Technical;Sectoral;Санкт-Петербургский государственный электротехнический университет ЛЭТИ им. В.И. Ульянова (Ленина) (СПбГЭТУ ЛЭТИ);Северо-Западный федеральный округ;г. Санкт-Петербург;Министерство науки и высшего образования Российской Федерации
240;Technical;Sectoral;Санкт-Петербургский политехнический университет Петра Великого;Северо-Западный федеральный округ;г. Санкт-Петербург;Министерство науки и высшего образования Российской Федерации
1789;Arts;Sectoral;Академия Русского балета имени А.Я. Вагановой;Северо-Западный федеральный округ;г. Санкт-Петербург;Министерство культуры Российской Федерации
1755;Sport;Sectoral;Национальный государственный Университет физической культуры, спорта и здоровья имени П.Ф.Лесгафта, Санкт-Петербург;Северо-Западный федеральный округ;г. Санкт-Петербург;Министерство спорта Российской Федерации
233;Arts;Sectoral;Санкт-Петербургская государственная художественно-промышленная академия имени А.Л. Штиглица;Северо-Западный федеральный округ;г. Санкт-Петербург;Министерство науки и высшего образования Российской Федерации
237;Technical;Sectoral;Санкт-Петербургский горный университет;Северо-Западный федеральный округ;г. Санкт-Петербург;Министерство науки и высшего образования Российской Федерации
236;Architectural;Sectoral;Санкт-Петербургский государственный архитектурно-строительный университет;Северо-Западный федеральный округ;г. Санкт-Петербург;Министерство науки и высшего образования Российской Федерации
232;Technical;Sectoral;Санкт-Петербургский государственный лесотехнический университет имени С.М. Кирова;Северо-Западный федеральный округ;г. Санкт-Петербург;Министерство науки и высшего образования Российской Федерации
1616;Medical;Sectoral;Санкт-Петербургский государственный педиатрический медицинский университет Министерства здравоохранения Российской Федерации;Северо-Западный федеральный округ;г. Санкт-Петербург;Министерство здравоохранения Российской Федерации
1735;Trasport;Sectoral;Санкт-Петербургский государственный университет гражданской авиации имени Главного маршала авиации А.А. Новикова;Северо-Западный федеральный округ;г. Санкт-Петербург;Федеральное агентство воздушного транспорта
1564;Technical;Sectoral;Санкт-Петербургский государственный университет телекоммуникаций им. проф. М.А. Бонч-Бруевича;Северо-Западный федеральный округ;г. Санкт-Петербург;Федеральное агентство связи
1771;;Calssic;Санкт-Петербургский государственный университет;Северо-Западный федеральный округ;г. Санкт-Петербург;Правительство Российской Федерации
1734;Medical;Sectoral;Северо-Западный государственный медицинский университет имени И.И. Мечникова Министерства здравоохранения Российской Федерации;Северо-Западный федеральный округ;г. Санкт-Петербург;Министерство здравоохранения Российской Федерации
13;Technical;Sectoral;Балтийский государственный технический университет ВОЕНМЕХ им. Д.Ф. Устинова;Северо-Западный федеральный округ;г. Санкт-Петербург;Министерство науки и высшего образования Российской Федерации
48;Arts;Sectoral;Высшая школа народных искусств (академия);Северо-Западный федеральный округ;г. Санкт-Петербург;Министерство науки и высшего образования Российской Федерации
1707;Trasport;Sectoral;Государственный университет морского и речного флота имени адмирала С.О. Макарова;Северо-Западный федеральный округ;г. Санкт-Петербург;Федеральное агентство морского и речного транспорта
1572;Medical;Sectoral;Первый Санкт-Петербургский государственный медицинский университет имени академика И.П. Павлова Министерства здравоохранения Российской Федерации;Северо-Западный федеральный округ;г. Санкт-Петербург;Министерство здравоохранения Российской Федерации
1580;Trasport;Sectoral;Петербургский государственный университет путей сообщения Императора Александра I;Северо-Западный федеральный округ;г. Санкт-Петербург;Федеральное агентство железнодорожного транспорта
211;Technical;Sectoral;Российский государственный гидрометеорологический университет;Северо-Западный федеральный округ;г. Санкт-Петербург;Министерство науки и высшего образования Российской Федерации
1722;Arts;Sectoral;Российский государственный институт сценических искусств;Северо-Западный федеральный округ;г. Санкт-Петербург;Министерство культуры Российской Федерации
213;Pedagogical;Sectoral;Российский государственный педагогический университет им. А. И. Герцена;Северо-Западный федеральный округ;г. Санкт-Петербург;Министерство просвещения Российской Федерации
1812;Arts;Sectoral;Санкт-Петербургская академия художеств имени Ильи Репина;Северо-Западный федеральный округ;г. Санкт-Петербург;Министерство культуры Российской Федерации
1648;Arts;Sectoral;Санкт-Петербургская государственная консерватория имени Н.А.Римского-Корсакова;Северо-Западный федеральный округ;г. Санкт-Петербург;Министерство культуры Российской Федерации
1590;Medical;Sectoral;Санкт-Петербургский государственный химико-фармацевтический университет Министерства здравоохранения Российской Федерации;Северо-Западный федеральный округ;г. Санкт-Петербург;Министерство здравоохранения Российской Федерации
1727;Agricultural;Sectoral;Санкт-Петербургский государственный аграрный университет;Северо-Западный федеральный округ;г. Санкт-Петербург;Министерство сельского хозяйства Российской Федерации
1738;Arts;Sectoral;Санкт-Петербургский государственный институт кино и телевидения;Северо-Западный федеральный округ;г. Санкт-Петербург;Министерство культуры Российской Федерации
1720;Arts;Sectoral;Санкт-Петербургский государственный институт культуры;Северо-Западный федеральный округ;г. Санкт-Петербург;Министерство культуры Российской Федерации
239;Technical;Sectoral;Санкт-Петербургский государственный морской технический университет;Северо-Западный федеральный округ;г. Санкт-Петербург;Министерство науки и высшего образования Российской Федерации
242;Technical;Sectoral;Санкт-Петербургский государственный технологический институт (технический университет);Северо-Западный федеральный округ;г. Санкт-Петербург;Министерство науки и высшего образования Российской Федерации
1714;Agricultural;Sectoral;Санкт-Петербургский государственный университет ветеринарной медицины;Северо-Западный федеральный округ;г. Санкт-Петербург;Министерство сельского хозяйства Российской Федерации
245;Technical;Sectoral;Санкт-Петербургский государственный университет промышленных технологий и дизайна;Северо-Западный федеральный округ;г. Санкт-Петербург;Министерство науки и высшего образования Российской Федерации
100256;Social Sciences and Humanities;Sectoral;Санкт-Петербургский государственный экономический университет;Северо-Западный федеральный округ;г. Санкт-Петербург;Министерство науки и высшего образования Российской Федерации
1785;;National Research;федеральное государственное бюджетное учреждение высшего образования и науки Санкт-Петербургский национальный исследовательский Академический университет имени Ж.И. Алферова Российской академии наук;Северо-Западный федеральный округ;г. Санкт-Петербург;Министерство науки и высшего образования Российской Федерации
217;;Federal and Flagship;Балтийский федеральный университет имени Иммануила Канта;Северо-Западный федеральный округ;Калининградская область;Министерство науки и высшего образования Российской Федерации
1601;Technical;Sectoral;Калининградский государственный технический университет;Северо-Западный федеральный округ;Калининградская область;Федеральное агентство по рыболовству
110180;Technical;Sectoral;Автономное образовательное учреждение высшего образования Ленинградской области Государственный институт экономики, финансов, права и технологий;Северо-Западный федеральный округ;Ленинградская область;Муниципалитеты и субъекты РФ
1602;Technical;Sectoral;Мурманский государственный технический университет;Северо-Западный федеральный округ;Мурманская область;Министерство науки и высшего образования Российской Федерации
173;;Federal and Flagship;Новгородский государственный университет имени Ярослава Мудрого;Северо-Западный федеральный округ;Новгородская область;Министерство науки и высшего образования Российской Федерации
1530;;Federal and Flagship;Псковский государственный университет;Северо-Западный федеральный округ;Псковская область;Министерство науки и высшего образования Российской Федерации
1741;Sport;Sectoral;Великолукская государственная академия физической культуры и спорта;Северо-Западный федеральный округ;Псковская область;Министерство спорта Российской Федерации
1660;Agricultural;Sectoral;Великолукская государственная сельскохозяйственная академия;Северо-Западный федеральный округ;Псковская область;Министерство сельского хозяйства Российской Федерации
1656;Arts;Sectoral;Петрозаводская государственная консерватория имени А.К. Глазунова;Северо-Западный федеральный округ;Республика Карелия;Министерство культуры Российской Федерации
199;;Federal and Flagship;Петрозаводский государственный университет;Северо-Западный федеральный округ;Республика Карелия;Министерство науки и высшего образования Российской Федерации
110281;Social Sciences and Humanities;Sectoral;Государственное образовательное учреждение высшего образования Коми республиканская академия государственной службы и управления;Северо-Западный федеральный округ;Республика Коми;Муниципалитеты и субъекты РФ
281;;Federal and Flagship;Сыктывкарский государственный университет имени Питирима Сорокина;Северо-Западный федеральный округ;Республика Коми;Министерство науки и высшего образования Российской Федерации
320;Technical;Sectoral;Ухтинский государственный технический университет;Северо-Западный федеральный округ;Республика Коми;Министерство науки и высшего образования Российской Федерации
1681;Agricultural;Sectoral;Вятский государственный агротехнологический университет (ФГБОУ ВО Вятский ГАТУ);Приволжский федеральный округ;Кировская область;Министерство сельского хозяйства Российской Федерации
50;;Federal and Flagship;Вятский государственный университет;Приволжский федеральный округ;Кировская область;Министерство науки и высшего образования Российской Федерации
1586;Medical;Sectoral;Кировский государственный медицинский университет Министерства здравоохранения Российской Федерации;Приволжский федеральный округ;Кировская область;Министерство здравоохранения Российской Федерации
110347;Social Sciences and Humanities;Sectoral;Нижегородский государственный инженерно-экономический университет;Приволжский федеральный округ;Нижегородская область;Муниципалитеты и субъекты РФ
170;;National Research;Национальный исследовательский Нижегородский государственный университет им. Н.И. Лобачевского;Приволжский федеральный округ;Нижегородская область;Министерство науки и высшего образования Российской Федерации
1652;Arts;Sectoral;Нижегородская государственная консерватория им. М.И. Глинки;Приволжский федеральный округ;Нижегородская область;Министерство культуры Российской Федерации
1778;Agricultural;Sectoral;Нижегородский государственный агротехнологический университет;Приволжский федеральный округ;Нижегородская область;Министерство науки и высшего образования Российской Федерации
166;Architectural;Sectoral;Нижегородский государственный архитектурно-строительный университет;Приволжский федеральный округ;Нижегородская область;Министерство науки и высшего образования Российской Федерации
167;Social Sciences and Humanities;Sectoral;Нижегородский государственный лингвистический университет им. Н.А.Добролюбова;Приволжский федеральный округ;Нижегородская область;Министерство науки и высшего образования Российской Федерации
168;Pedagogical;Sectoral;Нижегородский государственный педагогический университет имени Козьмы Минина (Мининский университет);Приволжский федеральный округ;Нижегородская область;Министерство просвещения Российской Федерации
1705;Trasport;Sectoral;Волжский государственный университет водного транспорта;Приволжский федеральный округ;Нижегородская область;Федеральное агентство морского и речного транспорта
169;;Federal and Flagship;Нижегородский государственный технический университет им. Р.Е. Алексеева;Приволжский федеральный округ;Нижегородская область;Министерство науки и высшего образования Российской Федерации
1587;Medical;Sectoral;Приволжский исследовательский медицинский университет Министерства здравоохранения Российской Федерации;Приволжский федеральный округ;Нижегородская область;Министерство здравоохранения Российской Федерации
110354;Arts;Sectoral;Оренбургский государственный институт искусств им. Л. и М. Ростроповичей;Приволжский федеральный округ;Оренбургская область;Муниципалитеты и субъекты РФ
186;Pedagogical;Sectoral;Оренбургский государственный педагогический университет;Приволжский федеральный округ;Оренбургская область;Министерство просвещения Российской Федерации
