id;Sector;Category;name;fed_okr;region;authority
11;;Calssic;Астраханский государственный университет имени В.Н. Татищева;Южный федеральный округ;Астраханская область;Министерство науки и высшего образования Российской Федерации
110167;Social Sciences and Humanities;Sectoral;Волжский институт экономики, педагогики и права;Южный федеральный округ;Волгоградская область;Муниципалитеты и субъекты РФ
110164;Arts;Sectoral;Государственное образовательное бюджетное учреждение культуры высшего образования Волгоградский государственный институт искусств и культуры;Южный федеральный округ;Волгоградская область;Муниципалитеты и субъекты РФ
110165;Arts;Sectoral;муниципальное бюджетное образовательное учреждение высшего образования Волгоградская консерватория имени П.А.Серебрякова;Южный федеральный округ;Волгоградская область;Муниципалитеты и субъекты РФ
36;;Calssic;Волгоградский государственный университет;Южный федеральный округ;Волгоградская область;Министерство науки и высшего образования Российской Федерации
1753;Sport;Sectoral;Волгоградская государственная академия физической культуры;Южный федеральный округ;Волгоградская область;Министерство спорта Российской Федерации
34;Pedagogical;Sectoral;Волгоградский государственный социально-педагогический университет;Южный федеральный округ;Волгоградская область;Министерство просвещения Российской Федерации
1697;Agricultural;Sectoral;Волгоградский государственный аграрный университет;Южный федеральный округ;Волгоградская область;Министерство науки и высшего образования Российской Федерации
1597;Medical;Sectoral;Волгоградский государственный медицинский университет Министерства здравоохранения Российской Федерации;Южный федеральный округ;Волгоградская область;Министерство здравоохранения Российской Федерации
35;;Federal and Flagship;Волгоградский государственный технический университет;Южный федеральный округ;Волгоградская область;Министерство науки и высшего образования Российской Федерации
113437;;Calssic;Севастопольский государственный университет;Южный федеральный округ;г. Севастополь;Министерство науки и высшего образования Российской Федерации
9;Pedagogical;Sectoral;Армавирский государственный педагогический университет;Южный федеральный округ;Краснодарский край;Министерство просвещения Российской Федерации
1663;Arts;Sectoral;Краснодарский государственный институт культуры;Южный федеральный округ;Краснодарский край;Министерство культуры Российской Федерации
108;Technical;Sectoral;Кубанский государственный технологический университет;Южный федеральный округ;Краснодарский край;Министерство науки и высшего образования Российской Федерации
1768;Trasport;Sectoral;Государственный морской университет имени адмирала Ф.Ф. Ушакова;Южный федеральный округ;Краснодарский край;Федеральное агентство морского и речного транспорта
1782;Agricultural;Sectoral;Кубанский государственный аграрный университет имени И.Т. Трубилина;Южный федеральный округ;Краснодарский край;Министерство сельского хозяйства Российской Федерации
1728;Medical;Sectoral;Кубанский государственный медицинский университет Министерства здравоохранения Российской Федерации (ФГБОУ ВО КубГМУ Минздрава России);Южный федеральный округ;Краснодарский край;Министерство здравоохранения Российской Федерации
1747;Sport;Sectoral;Кубанский государственный университет физической культуры, спорта и туризма;Южный федеральный округ;Краснодарский край;Министерство спорта Российской Федерации
109;;Calssic;Кубанский государственный университет;Южный федеральный округ;Краснодарский край;Министерство науки и высшего образования Российской Федерации
278;;Federal and Flagship;Сочинский государственный университет;Южный федеральный округ;Краснодарский край;Министерство науки и высшего образования Российской Федерации
1;;Calssic;Адыгейский государственный университет;Южный федеральный округ;Республика Адыгея;Министерство науки и высшего образования Российской Федерации
122;Technical;Sectoral;Майкопский государственный технологический университет;Южный федеральный округ;Республика Адыгея;Министерство науки и высшего образования Российской Федерации
92;;Federal and Flagship;Калмыцкий государственный университет имени Б.Б. Городовикова;Южный федеральный округ;Республика Калмыкия;Министерство науки и высшего образования Российской Федерации
5516;Pedagogical;Sectoral;Республики Крым Крымский инженерно-педагогический университет имени Февзи Якубова;Южный федеральный округ;Республика Крым;Муниципалитеты и субъекты РФ
5517;Arts;Sectoral;Республики Крым Крымский университет культуры, искусств и туризма;Южный федеральный округ;Республика Крым;Муниципалитеты и субъекты РФ
113416;;Federal and Flagship;Крымский федеральный университет имени В.И.Вернадского;Южный федеральный округ;Республика Крым;Министерство науки и высшего образования Российской Федерации
113221;Technical;Sectoral;Керченский государственный морской технологический университет;Южный федеральный округ;Республика Крым;Федеральное агентство по рыболовству
337;;Federal and Flagship;Южный федеральный университет;Южный федеральный округ;Ростовская область;Министерство науки и высшего образования Российской Федерации
228;Social Sciences and Humanities;Sectoral;Ростовский государственный экономический университет (РИНХ);Южный федеральный округ;Ростовская область;Министерство науки и высшего образования Российской Федерации
1671;Agricultural;Sectoral;Донской государственный аграрный университет;Южный федеральный округ;Ростовская область;Министерство сельского хозяйства Российской Федерации
70;;Federal and Flagship;Донской государственный технический университет;Южный федеральный округ;Ростовская область;Министерство науки и высшего образования Российской Федерации
1794;Arts;Sectoral;Ростовская государственная консерватория им. С.В.Рахманинова;Южный федеральный округ;Ростовская область;Министерство культуры Российской Федерации
1582;Medical;Sectoral;Ростовский государственный медицинский университет Министерства здравоохранения Российской Федерации;Южный федеральный округ;Ростовская область;Министерство здравоохранения Российской Федерации
1678;Trasport;Sectoral;Ростовский государственный университет путей сообщения;Южный федеральный округ;Ростовская область;Федеральное агентство железнодорожного транспорта
334;Technical;Sectoral;Южно-Российский государственный политехнический университет (НПИ) имени М.И. Платова;Южный федеральный округ;Ростовская область;Министерство науки и высшего образования Российской Федерации
80;;Calssic;Ингушский государственный университет;Северо-Кавказский федеральный округ;Республика Ингушетия;Министерство науки и высшего образования Российской Федерации
85;;Calssic;Кабардино-Балкарский государственный университет им. Х.М. Бербекова;Северо-Кавказский федеральный округ;Кабардино-Балкарская Республика;Министерство науки и высшего образования Российской Федерации
1658;Agricultural;Sectoral;Кабардино-Балкарский государственный аграрный университет имени В.М.Кокова;Северо-Кавказский федеральный округ;Кабардино-Балкарская Республика;Министерство сельского хозяйства Российской Федерации
1712;Arts;Sectoral;Северо-Кавказский государственный институт искусств;Северо-Кавказский федеральный округ;Кабардино-Балкарская Республика;Министерство культуры Российской Федерации
96;;Calssic;Северо-Кавказская государственная академия;Северо-Кавказский федеральный округ;Карачаево-Черкесская Республика;Министерство науки и высшего образования Российской Федерации
97;;Calssic;Карачаево-Черкесский государственный университет имени У.Д. Алиева;Северо-Кавказский федеральный округ;Карачаево-Черкесская Республика;Министерство науки и высшего образования Российской Федерации
110189;;Calssic;Дагестанский государственный университет народного хозяйства;Северо-Кавказский федеральный округ;Республика Дагестан;Муниципалитеты и субъекты РФ
1665;Agricultural;Sectoral;Дагестанский государственный аграрный университет имени М.М.Джамбулатова;Северо-Кавказский федеральный округ;Республика Дагестан;Министерство сельского хозяйства Российской Федерации
1558;Medical;Sectoral;Дагестанский государственный медицинский университет Министерства здравоохранения Российской Федерации;Северо-Кавказский федеральный округ;Республика Дагестан;Министерство здравоохранения Российской Федерации
62;Pedagogical;Sectoral;Дагестанский государственный педагогический университет;Северо-Кавказский федеральный округ;Республика Дагестан;Министерство просвещения Российской Федерации
63;Technical;Sectoral;Дагестанский государственный технический университет;Северо-Кавказский федеральный округ;Республика Дагестан;Министерство науки и высшего образования Российской Федерации
64;;Calssic;Дагестанский государственный университет;Северо-Кавказский федеральный округ;Республика Дагестан;Министерство науки и высшего образования Российской Федерации
1574;Medical;Sectoral;Северо-Осетинская государственная медицинская академия Министерства здравоохранения Российской Федерации;Северо-Кавказский федеральный округ;Республика Северная Осетия-Алания;Министерство здравоохранения Российской Федерации
1636;Agricultural;Sectoral;Горский государственный аграрный университет;Северо-Кавказский федеральный округ;Республика Северная Осетия-Алания;Министерство сельского хозяйства Российской Федерации
265;Technical;Sectoral;Северо-Кавказский горно-металлургический институт (государственный технологический университет);Северо-Кавказский федеральный округ;Республика Северная Осетия-Алания;Министерство науки и высшего образования Российской Федерации
267;;Calssic;Северо-Осетинский государственный университет имени Коста Левановича Хетагурова;Северо-Кавказский федеральный округ;Республика Северная Осетия-Алания;Министерство науки и высшего образования Российской Федерации
110345;Technical;Sectoral;Невинномысский государственный гуманитарно-технический институт;Северо-Кавказский федеральный округ;Ставропольский край;Муниципалитеты и субъекты РФ
110402;Pedagogical;Sectoral;Ставропольский государственный педагогический институт;Северо-Кавказский федеральный округ;Ставропольский край;Муниципалитеты и субъекты РФ
266;;Federal and Flagship;Северо-Кавказский федеральный университет;Северо-Кавказский федеральный округ;Ставропольский край;Министерство науки и высшего образования Российской Федерации
1642;Agricultural;Sectoral;Ставропольский государственный аграрный университет (ФГБОУ ВО Ставропольский ГАУ);Северо-Кавказский федеральный округ;Ставропольский край;Министерство сельского хозяйства Российской Федерации
207;;Calssic;Пятигорский государственный университет;Северо-Кавказский федеральный округ;Ставропольский край;Министерство науки и высшего образования Российской Федерации
1606;Medical;Sectoral;Ставропольский государственный медицинский университет Министерства здравоохранения Российской Федерации;Северо-Кавказский федеральный округ;Ставропольский край;Министерство здравоохранения Российской Федерации
326;Pedagogical;Sectoral;Чеченский государственный педагогический университет;Северо-Кавказский федеральный округ;Чеченская Республика;Министерство просвещения Российской Федерации
327;;Calssic;Чеченский государственный университет имени Ахмата Абдулхамидовича Кадырова;Северо-Кавказский федеральный округ;Чеченская Республика;Министерство науки и высшего образования Российской Федерации
61;Technical;Sectoral;Грозненский государственный нефтяной технический университет имени академика М.Д. Миллионщикова;Северо-Кавказский федеральный округ;Чеченская Республика;Министерство науки и высшего образования Российской Федерации
112;;Calssic;Курганский государственный университет;Уральский федеральный округ;Курганская область;Министерство науки и высшего образования Российской Федерации
331;Pedagogical;Sectoral;Шадринский государственный педагогический университет;Уральский федеральный округ;Курганская область;Министерство просвещения Российской Федерации
110200;Arts;Sectoral;Муниципальное бюджетное образовательное учреждение высшего образования Екатеринбургская академия современного искусства (институт);Уральский федеральный округ;Свердловская область;Муниципалитеты и субъекты РФ
214;Pedagogical;Sectoral;Российский государственный профессионально-педагогический университет;Уральский федеральный округ;Свердловская область;Министерство просвещения Российской Федерации
313;;Federal and Flagship;Уральский федеральный университет имени первого Президента России Б.Н. Ельцина;Уральский федеральный округ;Свердловская область;Министерство науки и высшего образования Российской Федерации
1679;Arts;Sectoral;Екатеринбургский государственный театральный институт;Уральский федеральный округ;Свердловская область;Министерство культуры Российской Федерации
1676;Arts;Sectoral;Уральская государственная консерватория имени М.П. Мусоргского;Уральский федеральный округ;Свердловская область;Министерство культуры Российской Федерации
1607;Medical;Sectoral;Уральский государственный медицинский университет Министерства здравоохранения Российской Федерации;Уральский федеральный округ;Свердловская область;Министерство здравоохранения Российской Федерации
312;Pedagogical;Sectoral;Уральский государственный педагогический университет;Уральский федеральный округ;Свердловская область;Министерство просвещения Российской Федерации
315;Social Sciences and Humanities;Sectoral;Уральский государственный экономический университет;Уральский федеральный округ;Свердловская область;Министерство науки и высшего образования Российской Федерации
309;Social Sciences and Humanities;Sectoral;Уральский государственный юридический университет имени В.Ф. Яковлева;Уральский федеральный округ;Свердловская область;Министерство науки и высшего образования Российской Федерации
1724;Agricultural;Sectoral;Уральский государственный аграрный университет;Уральский федеральный округ;Свердловская область;Министерство сельского хозяйства Российской Федерации
308;Architectural;Sectoral;Уральский государственный архитектурно-художественный университет;Уральский федеральный округ;Свердловская область;Министерство науки и высшего образования Российской Федерации
310;Technical;Sectoral;Уральский государственный горный университет;Уральский федеральный округ;Свердловская область;Министерство науки и высшего образования Российской Федерации
311;Technical;Sectoral;Уральский государственный лесотехнический университет;Уральский федеральный округ;Свердловская область;Министерство науки и высшего образования Российской Федерации
1759;Trasport;Sectoral;Уральский государственный университет путей сообщения;Уральский федеральный округ;Свердловская область;Федеральное агентство железнодорожного транспорта
